{
  "static/6jugement.pdf": {
    "file_path": "static/6jugement.pdf",
    "court_name": "THE SUPREME COURT OF INDIA",
    "case_id": "2024 INSC 199",
    "case_year": "2024",
    "judges_names": ["Pamidighantam", "Sri", "Narasimha", "Sandeep", "Mehta"],
    "parties_involved": {
      "appellants": ["MAHANADI", "COALFIELDS", "LTD."],
      "respondents": ["BRAJRAJNAGAR", "COAL", "MINES", "WORKERS’", "UNION"]
    },
    "sections": ["section 10", "section 19", "section 36", "section 18"],
    "acts": [],
    "summary": "Name of Court = 'THE SUPREME COURT OF INDIA'<br>Case ID = 2024 INSC 199<br>Case Year = 2024<br>Jydges Names= Pamidighantam Sri Narasimha Sandeep Mehta<br>Appellants Name = MAHANADI COALFIELDS LTD.<br>Respondents Name = BRAJRAJNAGAR COAL MINES WORKERS’ UNION<br> \n Inrrespect of other persons, it was contended, that they\n\nare engaged in purely casual nature of jobs, which are\n\nnot prohibited undler Contract Labour (R&A) Act, 1970,\n\nand accordingly, they are not eligible for\n\nregularisation.”\nIn view of the fact that the settlement is confined to only 19\nworkmen, the Central Government referred the entire dispute\nto the Industrial Tribunal under Section 10 (2A)(1)(d) of the\nIndustrial Disputes Act, 1947, on 20.05.1997 registered as\nDispute Case no. In the settlement arrived in\n1997, the stand of the appellant with respect to the 13 workers\nis as follows:\n\n“In respect of other persons, it was contended that they\n\nare engaged in purely casual nature of jobs which are\n\nnot prohibited under Contract Labour (R&A) Act, 1970\n\n12\n20. of\nworkers workers —_| workers\nwho who were| not\nexecuted | regularized | regularized\nworks\n\nBunker 19 16 3\n\nCoal Handling | 6 3 3\n\nPlant\n\nRailway Siding |7 - 7 |\n\nTotal: 32 19 13 ]\n\n‘The above-referred facts speak for themselves, and that is the\nreason why the Tribunal has come to a conclusion that the\ndenial of regularization of the 13 workmen is wholly unjustified.",
    "compressed_text": "bye ] \n matt \n tani ? \n 2024 INSC 199 reportable \n\n SUPREME court india \n CIVIL APPELLATE JURISDICTION \n\n CIVIL APPEAL NO(S ) . 4092 - 4093/2024 \n ( arising SLP ( C ) NO(S ) . 6370 - 6371/2024 \n\n ( arising SLP ( C ) diary . 32072 /2021 ) \n\n MAHANADI COALFIELDS LTD . ... appellant(s ) \n\n versu \n\n BRAJRAJNAGAR COAL MINES WORKERS ’ \n UNION .. RESPONDENT(S ) \n\n JUDGMENT \n\n PAMIDIGHANTAM SRI NARASIMHA , J. \n\n 1 . delay condone . leave grant . \n 2 . Appellant , Mahanadi Coalfields Ltd. , subsidiary Coal \n India Ltd. float tender transportation crush coal \n select successful contractor performance \n\n agreement period 1984 1994 . contractor \n\n employ workman execution contract . \n ' respondent - union espouse cause workman \n engage contractor seek permanent status \n . rely clause 11.5.1 11.5.2 National \n Coal Wage Agreement - IV date 27.07.1989 . \n clause , agree employer shall engage \n contract labour respect job permanent \n perennial nature . provide job shall \n execute regular employee . \n\n follow representation respondent - union , \n Assistant Labour Commissioner send notice appellant \n conciliation . conciliation process eventually culminate \n settlement date 05.04.1997 rule 58 \n Industrial Disputes ( Central ) rule , 1957 . relevant portion \n settlement follow : \n\n \" Union submit list 32 person say \n engage contractor demand \n { regularisation . alter verification , \n observe , follow person engage \n Bunker operate chute . \n\n ' sino . | Person Father \n o1 Sri Sadanand Bhoi Keshab \n\n 02 . Sri Purusottam Dau Govardhan \n\n 03 . Sri Anta Barik Gadadhar \n\n 04 . Sri Aditya Nikhandia Chera . \n\n 05 . ' Sri Bhabagrahi Pradhan D. Pradhan \n\n 2 \n 5 . \n\n 06 . Sei Sudarshan Khandit Masra \n 07 . Sri Ashok Kumar Rout Sitaram \n\n 08 . Sri Krishna Dau Goverdhan \n 09 , | Sri Abhimanyu Kisan ' Chhala \n\n 10 . Sri Lakhan Bhoi Keshab \n\n Sri Jay Narayan Bhoi Chaitan \n\n 2 Sri Sanatan Kisan Ugresan \n\n 13 . Sri Giridhari Raudia Goverdhan \n 14 Sri Daitari Pradhan Nira \n\n 15 . Sri Subram Bag ' Buchhu \n\n 16 . Sri Madhu Maral Dasa \n\n 17 . Sri Fakir Khamari Kartik \n\n 1b. Sri Sanatan Naik Ram Krishna \n 19 . ' Sri Sanatan Bho Tiharu \n\n operation permanent perennial \n\n nature , agree regularise 19 \n\n nineteen ) person General Mazdoor , Category , \n\n NCWA - v pay scale Rs . 65.40 - 1.08 - 85.52 . \n\n Inrrespect person , contend , \n\n engage purely casual nature job , \n\n prohibit undler Contract Labour ( R&A ) Act , 1970 , \n\n accordingly , eligible \n\n regularisation . \" \n view fact settlement confine 19 \n workman , Central Government refer entire dispute \n Industrial Tribunal section 10 ( 2a)(1)(d ) \n Industrial Disputes Act , 1947 , 20.05.1997 register \n Dispute Case . 27/2001 Industrial Tribunal , \n\n Rourkela , Odisha . Tribunal , workman examine \n 3 witness support case management \n examine 4 witness . \n judgment date 23.05.2002 , Tribunal allow \n industrial dispute direct regularization \n remain 13 workman . important finding Tribunal \n follow . outset , Tribunal reject \n preliminary objection jurisdiction \n Contract Labour ( Regulation Abolition Act ) , 1970 \n proceed consider nature work 13 \n workman perform . having consider matter \n detail , Tribunal hold work remove spillage \n railway siding , bunker operation chute ( \n bunker ) regular perennial nature . having \n consider evidence management witness , \n ' Tribunal conclude nature work perennial . \n accordingly , remain 13 worker direct \n regularize follow term : \n\n \" evidence straight clear 32 \n\n person attend . rest 13 \n\n person case regularize \n\n attend job , attend \n\n 19 person service regularize . \n\n 4 \n stand footing case rest 13 \n person ignore ground \n , deserve regularize reflect \n settlement . opinion 19 person \n regularize case rest 13 person \n attend type work \n regularize cause . ground state \n settlement deserve , opinion \n appear genuine ground discard \n case rest 13 person . inclined \n burden award place submission \n behalf party . necessary refer \n evidence Witness . 2 examine behalf \n Ist Party Management . clause 11.5.0 \n N.C.W.A. IV Contract Labourers engage \n ' permanent perennial nature job . \n ' state , enter settlement \n 19 person . evidence \n person 13 work Coal \n Handling Plant , permanent perennial \n nature . evidence Witness . 3 Ist . \n Party Management , work railway siding \n regular perennial nature \n 19 person regularize . 32 person \n attend job remove spillage \n railway bide bunker \n operation chute bunker . view \n evidence say rest 13 \n person attend job \n attend 19 person service \n regularize . soin opinion , \n settlement party regularize 19 person \n rest 13 person get cause action raise \n Industrial separate case \n ignore . word action Ist . \n Party Management regularize service \n rest 13 person accordance N.C.W.A. IV \n illegal unjustified . , issue answer \n accordingly . \" \n question legality validity Tribunal judgment , \n appellant file Writ Petition ( C ) number 2002/2002 \n Orissa High Court . \n\n ' Division Bench High Court hear matter , \n judgment , impugn , dismiss writ petition . \n ' High Court refer nature work perform \n workman affirm finding Tribunal base \n evidence witness MWS , personal manager \n appellant company . High Court take note \n evidence work railway siding regular \n perennial nature . admit respect \n work 19 worker regularize . High \n Court observe evidence dispute \n 32 worker engage remove spillage railway \n siding bunker , addition operating \n chute . High Court , , uphold view take \n Tribunal . Review Petition bear . 77/2017 file \n management dismiss order date \n\n 11.11.2021 . \n 10 . \n\n 10.1 \n\n 10.2 \n\n hear Mr. Aman Lekhi , learn Senior Counsel \n appear behalf appellant , assist Mr. Siddharth \n Jain , Mr. Soumyajit Pani Ms. Aishwary Bajpai , advocate \n Mr. Ashok Kumar Panda , learn Senior Counsel \n respondent - union , assist Mr. Tejaswi Kumar Pradhan , \n Mr. Mohan Prasad Gupta , Mr. Manoranjan Paikaray Mr. \n Shashwat Panda , advocate . \n\n ' submission appellant : court , appellant \n company contend Award date 23.05.2002 bad \n law . argue settlement bind party \n Section 18(1 ) read Section 36 , Industrial Disputes \n Act continue virtue section 19(2 ) \n Act , settlement terminate . \n\n ' settlement reach verification nature \n\n work perform . find 19 worker \n\n perform perennial permanent work work \n\n remain 13 worker ' casual ' nature . \n\n ' provision regularize worker \n\n NCWA - IV . provision regularization \n\n claim section 25f Industrial Disputes \n 7 \n 10.3 \n\n 11 . \n\n Act , say provision apply worker work \n direct supervision company certain \n period wrongfully stop . present case , \n workman work supervision contractor \n appellant , section 25f application . \n lastly , contend Tribunal wrongly direct \n appellant disburse backwage 13 worker . \n contrary settle principle grant backwage \n automatic natural consequence regularization . \n ' worker seek regularization backwage \n onus gainfully employ . , \n appellant rely J.K. Synthetics Ltd. v. K.P. Agrawal \n & anr . report ( 2007 ) 2 SCC 433 support \n contention . \n\n submission respondent - union : respondent- \n union submit 32 worker engage work \n\n similar nature . assert list industrial \n\n reference date 20.05.1997 show worker arbitrarily \n\n deprive regularization , certain worker \n\n bunker plant leave settlement \n\n 8 \n reason . argue work railway siding \n perennial regular nature , similar work \n bunker . \n\n 11.1 support contention , respondent - union rely \n evidence MW3 MW4 , personal manager \n project officer appellant company , respectively . \n MWS categorically admit removal spill coal . \n railway siding , bunker Coal Handling Plant \n regular perennial nature , MW4 state 32 worker \n engage similarly . submit \n evidence prove 13 worker actively participate \n task deem regular perennial . \n\n 11.2 resolution claim regularization \n similarly place worker , right pursue \n remedy Industrial Disputes Act , 1947 . submit \n rule 58 Industrial Dispute ( Central ) rule , 1957 \n settlement occur , pose legal \n\n obstruction remedy . \n 11.3 finally submit 13 workman suffer fault \n\n 12 . \n\n 13 . \n\n 14 . \n\n theirs order regularization naturally lead \n grant consequential backwage . \n\n Analysis finding : having hear party detail , \n opinion present appeal dispose \n follow reason . \n\n outset , appellant object Tribunal \n entertain industrial dispute pass award \n ground settlement S. 18(1 ) read S. 36 \n Industrial Disputes Act bind party S. \n 19(2 ) Act . substantive submission \n behalf appellant . fact case , unfold , \n lead arrival settlement , follow reference \n Industrial Tribunal , award , necessary \n consideration . \n\n place , 32 workman commence work \n contractor 1984 continue till 1994 . \n 1994 , respondent - union espouse cause 32 \n\n worker Asst . Labour Commissioner take entire \n\n 10 \n 18 . \n\n 16 . \n\n 17 . \n\n cause . culminate settlement date 05.04.1997 , \n rely appellant . \n\n appreciate submission settlement \n word Tribunal entertain \n reference pass Award , follow fact \n crucial . \n\n ' settlement talk claim 32 worker \n raise respondent - union . talk \n contention management engage \n ' purely casual ' nature job . sentence , \n agree regularize 19 contractor . important note , \n conscious fact settlement provide \n regularization 19 32 workman , government \n invoke power reference refer matter \n Tribunal adjudicate interest 32 worker . \n Tribunal naturally bind reference consider \n claim 32 worker . \n\n despite fact settlement respect \n workman , Tribunal task examine \n\n entire reference independent finding issue . \n\n il \n 18 . \n\n 19 . \n\n , Tribunal justify give award \n reference central government . answer \n objection raise appellant jurisdiction \n Tribunal . \n conscious fact jurisdiction \n exercise Article 136 Constitution . finding \n fact arrive Tribunal unassailable . \n opinion High Court correctly reject writ \n petition file award . apart concurrent \n finding fact , substantial question law \n appeal . \n , present case court \n exercise discretion . appeal 32 \n worker enter service appellant 1984 , \n continue uninterruptedly till 1994 , respondent- \n union seek permanence . settlement arrive \n 1997 , stand appellant respect 13 worker \n follow : \n\n \" respect person , contend \n\n engage purely casual nature job \n\n prohibit Contract Labour ( R&A ) Act , 1970 \n\n 12 \n 20 . \n\n 21 . \n\n ' accordingly , eligible \n regularisation . \" \n\n prove remain worker stand \n footing regularize employee , wrongly \n settlement . establish Tribunal , \n examine nature work undertake set \n 19 workman 13 workman . examine \n Shri Arun Ch , Hota ( WW ) , Deputy General Manager ( MW2 ) , \n Mr. Udayshankar Gonelal , Personal Manager ( MW3 ) \n Shri S. Agarwal , Project Officer ( MW4 ) . Tribunal finally \n come conclusion nature duty perform \n 13 workman perennial nature . appellant \n fail establish distinction set \n worker . Tribunal , , justify answer \n reference return finding hold \n status regularize employee . \n\n impress artificial distinction \n appellant seek bring 19 worker \n regularize 13 worker leave . \n\n evidence record disclose , total 32 workman , 19 \n\n 13 \n 22 . \n\n worker work bunker , 6 work Coal Handling \n Plant , 7 work railway siding . , 19 \n worker regularize , 16 work bunker , 3 \n work Coal Handling Plant . , 3 worker \n bunker , 3 worker Coal Handling Plant \n 7 worker railway siding \n\n regularize . tabulate representation description \n\n follow : \n\n site work | . | . of| . \n worker worker — _ | worker \n were| \n execute | regularize | regularize \n work \n\n Bunker 19 16 3 \n\n Coal Handling | 6 3 3 \n\n Plant \n\n Railway Siding |7 - 7 | \n\n Total : 32 19 13 ] \n\n ' - refer fact speak , \n reason Tribunal come conclusion \n denial regularization 13 workman wholly unjustified . \n state previously , find ground artificial \n distinction assert appellant . , case \n\n argue length think appropriate reason \n\n 14 \n 23 . \n\n 24 , \n\n 25 . \n\n reject appeal . refer hereinabove \n finding fact Tribunal affirm High \n Court . view concurrent finding fact issue \n nature work , continue nature work , continuous \n working workman , opinion \n merit appeal file appellant . \n\n case wrongful denial employment \n regularization , fault workman , \n order restrict wage . \n\n respect payment backwage , opinion \n workman entitle backwage observe \n Industrial Tribunal . , take account , long- \n draw litigation affect workman appellant \n equal measure take account public interest , \n confine backwage calculate decision \n Tribunal date 23.05.2002 . modification \n order Tribunal , affirm judgment \n High Court \n\n reason state , appeal arise final \n\n judgment order High Court W.P. ( C ) . \n 15 \n 2002/2002 order Review Petition . 77/2017 \n dismiss direction concerned workman shall \n entitle backwage effect 23.05.2002 . \n\n shall order cost . \n\n - J. \n [ Pamidighantam Sri Narasimha ] \n\n [ Sandeep Mehta ] \n\n New Delhi . \n March 12 , 2024 . \n\n 16 \n",
    "similar_cases": []
  },
  "static/3judgement.pdf": {
    "file_path": "static/3judgement.pdf",
    "court_name": "THE SUPREME COURT OF INDIA",
    "case_id": "2024 INSC 205",
    "case_year": "2024",
    "judges_names": ["Abhay", "S.", "Oka", "Ujjal", "Bhuyan"],
    "parties_involved": {
      "appellants": ["RAKESH", "RANJAN", "SHRIVASTAVA"],
      "respondents": ["THE", "STATE", "OF", "JHARKHAND", "&", "ANR"]
    },
    "sections": [
      "section 357",
      "section 148",
      "section 2",
      "section 421",
      "section 262",
      "section 259",
      "section 143",
      "section 138",
      "section 139"
    ],
    "acts": ["ni ", "instruments "],
    "summary": "Name of Court = 'THE SUPREME COURT OF INDIA'<br>Case ID = 2024 INSC 205<br>Case Year = 2024<br>Jydges Names= Abhay S. Oka Ujjal Bhuyan <br>Appellants Name = RAKESH RANJAN SHRIVASTAVA<br>Respondents Name = THE STATE OF JHARKHAND & ANR<br> \n (5) The interim compensation payable\nunder this section may be recovered as if\nit were a fine under Section 421 of\nthe Code of Criminal Procedure, 1973 (2\nof 1974)\n\n(6) The amount of fine imposed under\nSection 138 or the amount of\ncompensation awarded under\nSection 357 of the Code of Criminal\nProcedure, 1973 (2 of 1974), shall be\nreduced by the amount paid or recovered\nas interim compensation under this\nsection.”\n\n(emphasis added)\n7.1. Act does not prescribe any mode of recovery of\nthe compensation amount from the complainant together with\ninterest as provided in sub-section (4) of Section 143A, as sub-\nsection (4) provides for refund of interim compensation by the\ncomplainant to the accused and as sub-section (5) provides for\nmode of recovery of the interim compensation, obviously for\nrecovery of interim compensation from the complainant, the\nmode of recovery will be as provided in Section 421 of the CrPC. (3) The Appellate Court may direct the\nrelease of the amount deposited by the\nappellant to the complainant at any\ntime during the pendency of the\nappeal:\n\nProvided that if the appellant is\nacquitted, the Court shall direct the\ncomplainant to repay to the appellant\nthe amount so released, with interest\nat the bank rate as published by the\nReserve Bank of India, prevalent at the\nbeginning of the relevant financial\nyear, within sixty days from the date of\nthe order, or within such further\nperiod not exceeding thirty days as\nmay be directed by the Court on\nsufficient cause being shown by the\ncomplainant.”\n\n‘Sub-section (1) of Section 148 confers on the Appellate Court a\npower to direct the appellant/accused to deposit 20 per cent of\nthe compensation amount.",
    "compressed_text": "2024 INSC 205 , \n\n reportable \n\n SUPREME court INDIA \n CRIMINAL APPELLATE JURISDICTION \n\n CRIMINAL APPEAL . 741 2024 \n rakesh ranjan SHRIVASTAVA APPELLANT \n versu \n STATE JHARKHAND & ANR . _ ... respondent . \n\n JUDGMENT \n\n ABHAY S. OKA , J. \n 1 . issue involve criminal appeal \n\n provision sub - section ( 1 ) section 143A Negotiable \n Instruments Act , 1881 ( short , ' N.I. Act ) , provide \n grant interim compensation , directory \n mandatory . itis hold directory provision , question \n arise , factor consider exercise \n\n power sub - section ( 1 ) section 143A N.I. Act . \n\n FACTUAL ASPECTS \n\n case 24 respondent Complaint \n\n 2 . 2 m respondent ( hereinafter refer ' \n respondent ) complainant complaint Section \n 138 N.I. Act . complaint file Court \n\n Chief Judicial Magistrate Bokaro . case complaint \n\n appellant respondent form \n\n CCl . appeal . 741 2024 Page 1 18 \n company different term condition profit \n sharing , 23 % September 2011 , appointment letter \n issue appellant capacity Managing \n Director company M / s Thermotech Synergy Pvt . Ltd. \n behalf proprietary concern , M / s Tech Synergy , \n post Executive Director offer appellant \n respondent consolidated salary Rs . 1,00,000/- \n\n month , \n\n 3 . 1 * June 2012 , appellant form partnership \n Rahul Kumar Basu , respondent \n show indirect partner . accord respondent \n case , M / s Tech Synergy merge company - \n M / s Megatech Synergy Pvt . Ltd. Itis allege respondent \n August 2012 , agreement pay 50 \n cent profit . partnership firm come \n existence 3 ° June 2013 , appellant , respondent , \n Rahul Kumar show partner . case \n respondent appellant agree 50 cent share \n profit company , Geotech Synergy Pvt . Ltd. \n allege appellant pay amount \n payable respondent . , legal notice issue \n appellant respondent . accord case \n respondent , appellant liable pay total \n r , 4,38,80,000/- respondent , fact , civil suit \n file respondent Civil Court Bokaro \n recovery said . , 13 % July 2018 , \n\n meeting party Ranchi \n\n CCl . appeal . 741 2024 Page 2 18 \n appellant agree pay sum Rs . 4,25,00,000/- \n respondent , cheque sum Rs , 2,20,00,000/- \n 2,05,00,000/- date 6 August 2018 19 % September \n 2018 respectively hand appellant . \n cheque sum Rs . 2,20,00,000/- dishonour , \n complaint file service statutory notice \n allege commission offence punishable \n Section 138 N.I. Act learn Magistrate take \n\n cognizance offence . \n\n application section 143A NI Act \n 4 . Court learn Magistrate , \n respondent move application section 143A \n NL . Act seek direction appellant / accuse \n pay 20 cent cheque compensation . \n order date 7th March 2020 , learn Judicial Magistrate \n allow application direct appellant pay \n interim compensation Rs . 10,00,000/- respondent \n 60 day . ' Sessions Court affirm order \n learn Magistrate revision application . say order \n subject challenge High Court . \n learn Judge Jharkhand High Court dismiss petition \n impugn judgment . order subject \n\n matter challenge present criminal appeal . \n\n submission \n\n 8 . learn counsel appear appellant point \n sub - section ( 1 ) section 143A N.I. Act use \n\n word ' ' , , provision discretionary . \n\n CCl . appeal . 741 2024 Page 3 18 \n submit Trial Court pass order pay \n interim compensation mechanically . submit \n Court apply mind fact case \n pass drastic order deposit . submit \n existence prima facie case essential exercise \n power section 143A. prima facie consideration \n merit complainant case defence \n accuse , Court conclude case \n grant interim compensation . Court come \n conclusion case grant interim compensation \n , Court apply mind \n quantum interim compensation . case , Court \n grant 20 cent cheque interim \n\n compensation . \n\n 6 . learned counsel appear respondent \n submit consider object section 138 \n N.L. Act , sub - section ( 1 ) section 143A hold \n mandatory . submit presumption \n section 139 N.I. Act contrary prove , \n holder cheque receive cheque discharge , \n , debt liability . submit \n question rebut say presumption arise \n evidence adduce . , defence \n accuse stage consider application sub- \n section ( 1 ) section 143A irrelevant . case , order \n payment interim compensation follow . submit \n\n hold sub - section ( 1 ) section 143A \n\n CCl . appeal . 741 2024 Page 4 18 \n mandatory , object legislature enact \n\n provision frustrate . \n\n consideration submission \n\n object section 143A \n\n 7 . section 143A bring statute book Act . \n 20 2018 effect 1 * ' September 2018 . section 143A , \n\n read : \n\n CCl . appeal . 741 \n\n \" 143 - , power direct interim \n compensation.—{1 ) notwithstanding \n contain Code \n Criminal Procedure , 1973 ( 2 1974 ) , \n Court try offence \n Section 138 order drawer \n cheque pay interim \n compensation complainant — \n\n ( ) summary trial \n summon case , plead \n guilty accusation \n complaint ; \n\n ( » ) case , \n framing charge . \n\n ( 2 ) interim compensation \n sub - section ( 1 ) shall exceed \n cent cheque \n . \n\n ( 3 ) interim compensation shall \n pay day date \n order sub - section ( 1 ) , \n period exceed thirty \n day direct Court \n sufficient cause show \n drawer cheque . \n\n ( 4 ) drawer cheque \n acquit , Court shall direct \n\n 2028 \n\n page $ 18 \n complainant repay drawer \n interim compensation , \n interest bank rate publish \n Reserve Bank India , prevalent \n beginning relevant financial \n year , day date \n order , period \n exceed thirty day \n direct Court sufficient cause \n show complainant . \n\n ( 5 ) interim compensation payable \n section recover \n fine section 421 \n Code Criminal Procedure , 1973 ( 2 \n 1974 ) \n\n ( 6 ) fine impose \n section 138 \n compensation award \n section 357 Code Criminal \n Procedure , 1973 ( 2 1974 ) , shall \n reduce pay recover \n interim compensation \n section . \" \n\n ( emphasis add ) \n 7.1 . statement object reason , state \n unscrupulous drawer cheque prolong proceeding \n complaint section 138 file appeal \n obtain stay . , injustice cause payee \n dishonoured cheque , spend considerable time \n resource Court proceeding realise value \n cheque . observe delay compromise \n sanctity cheque transaction . , \n propose amend Nil . Act address issue undue \n\n delay final resolution cheque dishonour case . \n\n CCl . appeal . 741 2024 Page 6 18 \n state propose amendment \n strengthen credibility cheque help trade \n\n 8 . note Act no.20 2018 , \n section 148 bring statute book , provide \n appeal prefer drawer conviction \n Section 138 , Appellate Court order appellant , \n deposit sum shall minimum 20 cent \n fine compensation award Trial Court . \n proviso sub - section ( 1 ) section 148 clarify \n payable sub - section ( 1 ) section 148 \n addition interim compensation pay \n appellant / accuse section 143A. separate \n\n object reason set addition Section 148 . \n\n mandatory directory \n\n 9 . doubt word \" \" ordinarily \n mean \" \" . ordinarily , \" \" construe \n \" shall \" , inflexible rule . use word \n \" \" certain legislation construe \" shall \" , \n word \" shall \" construe \" \" . depend . \n nature power confer relevant provision \n statute effect exercise power . \n legislative intent play role interpretation \n provision . context word \" \" \n\n relevant . \n\n CCl . appeal . 741 2024 Page 7 18 \n 10 . power sub - section ( 1 ) section 143A \n direct payment interim compensation summary trial \n summon case recording plea \n accuse guilty , case , \n framing charge . maximum punishment section \n 138 N.I. Act imprisonment 2 year , view \n clause ( w ) read clause ( x ) section 2 Code \n Criminal Procedure , 1973 ( short , ' Cr . PC ) , case \n section 138 N.I. Act triable summon case . \n , sub - section ( 1 ) Section 143 provide \n notwithstanding contain Cr . PC , learn \n Magistrate shall try complaint adopt summary \n procedure section 262 265 Cr . PC . , \n commencement trial course \n summary trial , appear Court sentence \n imprisonment term exceed year \n pass reason undesirable try case \n summarily , case shall try manner provide \n CrPC . , complaint Section 138 \n summon case contingency . note \n section 259 Cr . PC , subject provide \n said Section , learn Magistrate discretion \n convert summon case warrant case . warrant \n case , question frame charge . , clause \n ( 0 ) sub - section ( 1 ) section 143A apply \n case try warrant case . case summary \n summon trial , power sub - section ( 1 ) section \n\n 143A exercise plea accuse record . \n\n CCl . appeal . 741 2024 Page 8 18 \n 11 . sub - section ( 5 ) section 143A , provide \n interim compensation recover \n fine section 421 Cr . PC . , \n legal fiction , interim compensation treat fine \n purpose recovery . section 421 Cr . pc deal \n recovery fine impose criminal court \n pass sentence . , recourse take Section \n 421 Cr . PC . recovery interim compensation , \n read : \n\n \" a21 . warrant levy fine.—(1 ) \n offender sentence \n pay fine , Court pass \n sentence action \n recovery fine \n follow way , , \n — \n { issue warrant levy \n attachment \n sale movable property \n belong offender ; \n\n ( B ) issue warrant Collector \n district , authorise \n realise arrear \n land revenue movable \n immovable property , , \n defaulter : \n\n provide , sentence \n direct default payment \n fine , offender shall imprison , \n offender undergo \n imprisonment default , \n Court shall issue warrant \n , special reason \n record writing , consider \n necessary , \n order payment expense \n\n CCl . appeal . 741 2024 Page 9 18 \n compensation fine \n section 357 . \n\n ( 2 ) State Government \n rule regulate manner \n warrant clause ( ) sub - section \n ( 1 ) execute , \n summary determination claim \n person \n offender respect property \n attach execution warrant . \n\n ( 3 ) Court issue warrant \n Collector clause ( b ) sub- \n section ( 1 ) , Collector shalll realise \n accordance law \n relate recovery arrear land \n revenue , warrant \n certificate issue law : \n\n provide warrant shall \n\n execute arrest detention \n\n prison offender . \" \n 12 . non - payment interim compensation accuse \n away right defend prosecution . ' \n interim compensation recover \n treat fine , interim compensation \n recover Trial Court issue warrant \n attachment sale movable property accuse . \n power vest Court issue warrant \n Collector District authorise realise \n interim compensation arrear land revenue . \n movable immovable property , , belong \n accuse . recovery interim compensation , \n immovable movable property accuse sell \n\n Collector . , non - payment interim compensation \n\n CCl . appeal . 741 2024 Page 10 18 , \n fix section 143A drastic consequence . recover \n , accuse deprive immovable \n movable property . acquit , money \n interest provide sub - section ( 4 ) section \n 143A complainant , , movable immovable \n property sell recovery interim compensation , \n acquit , property . \n , N.I. Act prescribe mode recovery \n compensation complainant \n interest provide sub - section ( 4 ) section 143A , sub- \n section ( 4 ) provide refund interim compensation \n complainant accuse sub - section ( 5 ) provide \n mode recovery interim compensation , obviously \n recovery interim compensation complainant , \n mode recovery provide section 421 CrPC . \n long - draw process involve recovery \n complainant . complainant \n\n asset , recovery impossible . \n\n 13 . stage , note sub - section ( 1 ) Section 148 , \n Section 148 read : \n\n \" 148 . power Appellate Court \n order payment pende appeal \n conviction.—(1 ) \n notwithstanding contain \n Code Criminal Procedure , \n 1973 ( 2 1974 ) , appeal \n drawer conviction \n section 138 , Appellate Court \n order appellant deposit \n sum shall minimum \n cent fine \n\n CCl . appeal . 741 2024 Page 11 18 , \n compensation award trial \n Court : \n\n provide payable \n sub - section shall \n addition interim compensation \n pay appellant section \n 143A. \n\n ( 2 ) refer sub- \n section ( 1 ) shall deposit \n day date order , \n period \n exceed thirty day \n direct Court sufficient \n cause show appellant . \n\n ( 3 ) Appellate Court direct \n release deposit \n appellant complainant \n time pendency \n appeal : \n\n provide appellant \n acquit , Court shall direct \n complainant repay appellant \n release , interest \n bank rate publish \n Reserve Bank India , prevalent \n beginning relevant financial \n year , day date \n order , \n period exceed thirty day \n direct Court \n sufficient cause show \n complainant . \" \n\n ' sub - section ( 1 ) section 148 confer Appellate Court \n power direct appellant / accuse deposit 20 cent \n compensation . operate different level \n power thereunder exercise \n\n appellant / accuse convict trial . \n\n CCl . appeal . 741 2024 Page 12 18 , \n 14 , case section 143A , power exercise \n accuse hold guilty . sub - section ( 1 ) \n section 143A provide pass drastic order payment \n interim compensation accuse complaint \n Section 138 , adjudication \n guilt accuse . power exercise \n threshold evidence record . word \n ' ' interpret ' shall ' , drastic consequence \n complaint Section 138 , accuse \n pay interim compensation 20 cent cheque \n . interpretation unjust contrary \n - settle concept fairness justice . \n interpretation , provision expose \n vice manifest arbitrariness , provision hold \n violative Article 14 Constitution . sense , sub- \n section ( 1 ) section 143A provide penalise accuse \n guilt establish . consider drastic \n consequence exercise power section 143a \n finding guilt record trial , \n word \" \" provision construe \n \" shall \" . provision hold directory \n mandatory . , manner doubt word \n \" \" section 143A , construe interpret \n \" shall \" . , power sub - section ( 1 ) section , \n\n 143A discretionary . \n\n CCl . appeal . 741 2024 Page 13 18 , \n 15 . sub - section ( 1 ) section 148 use word \" \" . \n case Surinder Singh Deswal v. Virender Gandhi ? , \n Court , consider provision Section 148 , hold \n word \" \" generally \n construe \" rule \" \" shall \" . observe \n Appellate Court decide direct deposit \n accuse , record reason . consider \n say decision case Surinder Singh Deswal ! , \n Court , case Jamboo Bhandari v. Madhya Pradesh \n State Industrial Development Corporation Limited & Ors . ? , \n paragraph 6 , hold : \n\n \" 6 . hold Court \n purposive interpretation \n Section 148 NI Act . , normally , \n appellate court justify \n impose condition deposit \n provide Section 148 . , \n case appellate court \n satisfied condition deposit \n 20 % unjust impose \n condition deprivation \n right appeal appellant , \n exception reason \n specifically record . \" \n\n ( emphasis add ) \n\n 18.1.As hold early , section 143A invoke \n conviction accuse , , word \" \" \n construe \" shall \" . test applicable \n\n exercise jurisdiction sub - section ( 1 ) section \n\n * ( gois ) 12sec aan \n » ( 2023 ) 10sec aas \n\n CCl . appeal . 741 2024 Page 14 18 , \n 148 apply exercise jurisdiction sub- \n\n section ( 1 ) section 143A N.I. Act . \n\n factors consider exercise \n discretion \n\n 16 . court deal application section \n 143A N.I. Act , Court prima facie evaluate \n merit case complainant \n merit defence plead accuse reply \n application sub - section ( 1 ) section 143A. \n presumption section 139 N.L. Act , , \n ground direct payment interim compensation . ' \n reason presumption rebuttable . question \n apply presumption arise trial . \n complainant make prima facie case , direction \n issue pay interim compensation . stage , fact \n accuse financial distress consideration . \n Court conclude case grant \n interim compensation , Court apply mind \n quantum interim compensation grant . \n stage , Court consider factor \n nature transaction , relationship , , \n accuse complainant pay \n capacity accuse . defence accuse find \n prima facie plausible defence , Court exercise \n discretion refuse grant interim compensation . \n note factor require consider , \n set , exhaustive . \n\n factor fact give case , , pendency \n\n CCl . appeal . 741 2024 Page 15 18 , \n civil suit , etc . decide prayer Section \n 143A , Court record brief reason indicate \n\n consideration relevant factor . \n\n 17 . present case , Trial Court mechanically \n pass order deposit Rs.10,00,000/- \n consider issue prima facie case relevant \n factor . true sum Rs.10,00,000/- represent \n 5 cent cheque , direction , \n issue pay application mind . \n High Court apply mind . , , \n propose direct Trial Court consider application \n grant interim compensation afresh . , \n Rs . 10,00,000/- deposit appellant \n\n continue remain deposit Trial Court . \n\n 18 , , impugn order set aside , application \n complainant Complaint Petition , 1103/2018 \n section 143A ( 1 ) N.I. Act restore file \n Judicial Magistrate Class , Bokaro , learned Judge \n hear decide application grant interim \n compensation afresh light hold \n judgment . deposit appellant Rs . \n 10,00,000/- shall invest fix deposit till disposal \n said application , time dispose \n application , Trial Court pass appropriate order \n refund and/or withdrawal and/or investment \n\n say . \n\n CCl . appeal . 741 2024 Page 16 18 , \n 19 . subject hold early , main conclusion \n\n summarise follow \n\n , exercise power sub - section ( 1 ) section 143A , \n discretionary . provision directory \n mandatory . word \" \" provision \n\n construe \" shall . \" \n\n b. decide prayer section 143A , \n Court record brief reason indicate consideration \n\n relevant factor . \n\n ¢. broad parameter exercise discretion \n section 143A follow : \n\n i. Court prima facie evaluate merit \n case complainant \n merit defence plead accuse \n reply application . financial distress \n\n accuse consideration , \n\n ii , direction pay interim compensation issue , \n\n complainant make prima facie case \n\n iii , defence accuse find prima facie \n plausible , Court exercise discretion \n\n refuse grant interim compensation . \n\n iv . Ifthe Court conclude case grant \n interim compensation , apply \n mind quantum interim compensation \n\n grant . , Court \n\n CCl . appeal . 741 2024 Page 17 18 , \n consider factor nature \n transaction , relationship , , \n\n accuse complainant , ete . \n\n v. relevant factor \n peculiar fact give case , \n exhaustively state . parameter state \n\n exhaustive . \n\n 20 . Appeal partly allow term . \n\n J \n ( Abhay S. Oka ) \n\n J \n ( Ujjal Bhuyan ) \n\n New Delhi ; \n March 15 , 2024 \n\n CCl . appeal . 741 2024 Page 18 18 , \n",
    "similar_cases": []
  }
}
